{
  "$ref": "#/definitions/authors",
  "definitions": {
    "authors": {
      "type": "object",
      "properties": {
        "name": {
          "type": "string"
        },
        "role": {
          "type": "string"
        },
        "bio": {
          "type": "string"
        },
        "avatar": {
          "type": "string"
        },
        "social": {
          "type": "object",
          "properties": {
            "twitter": {
              "type": "string"
            },
            "linkedin": {
              "type": "string"
            },
            "github": {
              "type": "string"
            }
          },
          "additionalProperties": false
        },
        "expertise": {
          "type": "array",
          "items": {
            "type": "string"
          }
        },
        "$schema": {
          "type": "string"
        }
      },
      "required": [
        "name",
        "role",
        "bio",
        "avatar",
        "expertise"
      ],
      "additionalProperties": false
    }
  },
  "$schema": "http://json-schema.org/draft-07/schema#"
}