{
  "name": "Sarah Johnson",
  "role": "Senior Content Strategist",
  "bio": "Sarah brings over 10 years of experience in the equipment rental industry, helping businesses optimize their operations and grow revenue through strategic content and industry insights.",
  "avatar": "/images/authors/sarah-johnson.jpg",
  "social": {
    "twitter": "https://x.com/rentgrab",
    "linkedin": "https://www.linkedin.com/company/rentgrab"
  },
  "expertise": ["Equipment Rental", "Business Strategy", "Content Marketing", "Industry Analysis"]
}